{
  "id": "ant-design",
  "name": "Ant Design",
  "source": "https://ant.design/",
  "maker": "Ant Group",
  "fit": "Enterprise forms and dashboards driven by one seed color.",
  "principles": "Natural, certain, meaningful, growing. A seed color derives the palette, so there is one color source.",
  "color": "Seed roles: primary, success, warning, and error. The published defaults are primary #1677ff, success #52c41a, warning #faad14, and error #ff4d4f. Those seeds map to semantic roles.",
  "typography": "A system sans stack, with a numeric scale for titles and body.",
  "spacing": "An 8px base with component padding tokens.",
  "shape": "A border-radius token on controls.",
  "elevation": "Shadow levels for cards and overlays.",
  "layout": "A 24-column grid and a side-plus-header layout.",
  "icons": "A large outlined and filled icon set.",
  "components": "A very large set. Use only what this app needs: form, table, menu, modal, message.",
  "themes": "Light and dark algorithm themes from the same seed.",
  "adapt": "Keep the seed-to-role model and the form density. Do not import the whole component catalog. Change the seed and the font."
}
