{
  "id": "gestalt",
  "name": "Gestalt",
  "source": "https://github.com/pinterest/gestalt",
  "maker": "Pinterest",
  "fit": "Creation and content products in Pinterest's design language.",
  "principles": "A React component set that carries Pinterest's design language. The public docs require a sign-in, so token roles are not confirmed here.",
  "color": "Unconfirmed.",
  "typography": "Unconfirmed.",
  "spacing": "Unconfirmed.",
  "shape": "Unconfirmed.",
  "elevation": "Unconfirmed.",
  "layout": "Unconfirmed.",
  "icons": "Unconfirmed.",
  "components": "Unconfirmed.",
  "themes": "Unconfirmed.",
  "adapt": "Open the source before using a color, type size, space, or shadow. Keep only the roles the source names. Replace Pinterest's brand."
}
